{
  "$schema": "../../../ecosystem/capability-manifest.schema.json",
  "schemaVersion": 1,
  "id": "drawing",
  "packageName": "@file-viewer/renderer-drawing",
  "rendererIds": ["drawing"],
  "formats": ["excalidraw", "drawio", "dio", "mermaid", "mmd", "plantuml", "puml"],
  "assets": { "rendererIds": [] },
  "license": { "spdx": "Apache-2.0", "policy": "permissive" },
  "weight": "heavy",
  "profiles": ["all"]
}
