{
  "$schema": "../../../ecosystem/capability-manifest.schema.json",
  "schemaVersion": 1,
  "id": "presentation-openxml",
  "packageName": "@file-viewer/renderer-pptx",
  "rendererIds": ["office-presentation"],
  "formats": ["pptx", "pptm", "potx", "potm", "ppsx", "ppsm"],
  "assets": {
    "rendererIds": ["office-presentation"],
    "packageName": "@file-viewer/assets-standard",
    "bin": "file-viewer-assets-standard",
    "apiExport": "installFileViewerStandardAssets",
    "target": "public/file-viewer",
    "copyGroups": ["office-presentation"],
    "copyMode": "profile-pack",
    "receiptFilename": "file-viewer-assets-standard.receipt.json",
    "notice": "Native PPTX parsing Worker."
  },
  "license": { "spdx": "Apache-2.0", "policy": "permissive" },
  "weight": "standard",
  "profiles": ["standard", "office", "all"]
}
