{
  "$schema": "../../../ecosystem/capability-manifest.schema.json",
  "schemaVersion": 1,
  "id": "chm",
  "packageName": "@file-viewer/renderer-chm",
  "rendererIds": ["chm"],
  "formats": ["chm"],
  "assets": {
    "rendererIds": ["chm"],
    "packageName": "@file-viewer/assets-chm",
    "installerPackageName": "@file-viewer/assets-chm",
    "bin": "file-viewer-assets-chm",
    "apiExport": "installFileViewerCapabilityAssetPack",
    "target": "public/file-viewer",
    "copyGroups": ["chm"],
    "copyMode": "capability-pack",
    "receiptFilename": "file-viewer-assets-chm.receipt.json",
    "notice": "Self-hosted CHM module Worker and Rust/WebAssembly parser runtime."
  },
  "license": {
    "spdx": "Apache-2.0",
    "policy": "permissive",
    "notices": [
      {
        "packageName": "RustChm",
        "spdx": "MIT",
        "notice": "Permissively licensed CHM parser reference; exact source provenance is recorded in THIRD_PARTY_NOTICES.md and rust/NOTICE.md."
      },
      {
        "packageName": "FastChm",
        "spdx": "MIT",
        "notice": "Permissively licensed CHM and LZX reference; exact source provenance is recorded in THIRD_PARTY_NOTICES.md and rust/NOTICE.md."
      }
    ]
  },
  "weight": "heavy",
  "profiles": ["all"]
}
