{
  "$schema": "../../../ecosystem/capability-manifest.schema.json",
  "schemaVersion": 1,
  "id": "email",
  "packageName": "@file-viewer/renderer-email",
  "rendererIds": ["email"],
  "formats": ["eml", "msg", "mbox"],
  "assets": { "rendererIds": [] },
  "license": { "spdx": "Apache-2.0", "policy": "permissive" },
  "weight": "light",
  "profiles": ["standard", "all"]
}
