{
  "$schema": "../../../ecosystem/capability-manifest.schema.json",
  "schemaVersion": 1,
  "id": "ofd",
  "packageName": "@file-viewer/renderer-ofd",
  "rendererIds": ["ofd"],
  "formats": ["ofd"],
  "assets": { "rendererIds": [] },
  "license": { "spdx": "Apache-2.0", "policy": "permissive" },
  "weight": "standard",
  "profiles": ["standard", "office", "all"]
}
